{
  "schema_version": "1.0.0",
  "source_note_card_id": "source_note_card_monday_dev_official_pm_visibility_2026",
  "workspace_id": "ws_productos_v2",
  "source_type": "competitor_site",
  "source_ref": "https://monday.com/w/dev",
  "title": "monday dev official product lifecycle positioning",
  "claim": "monday dev positions itself as one platform to plan roadmaps, manage sprints, release products, monitor issues, and share documentation with AI support.",
  "source_snippet": "The product page explicitly covers roadmap planning, sprint management, release coordination, analytics, and AI-powered summaries.",
  "implication": "ProductOS should keep the lifecycle-wide view but add stricter gate evidence and artifact traceability than flexible work boards usually provide by default.",
  "confidence": "high",
  "followup_questions": [
    "Which artifact relationships in monday dev are modeled structurally versus conventionally?"
  ],
  "source_metadata": {
    "source_url": "https://monday.com/w/dev",
    "retrieved_at": "2026-03-23T09:28:00Z",
    "credibility_tier": "primary"
  },
  "dedupe_key": "monday_dev_pm_visibility_2026",
  "linked_entity_refs": [
    {
      "entity_type": "opportunity",
      "entity_id": "opp_pm_lifecycle_traceability"
    }
  ],
  "tags": [
    "research",
    "competitor",
    "monday-dev",
    "product-lifecycle"
  ],
  "created_at": "2026-03-23T09:28:00Z"
}
