{
  "schema_version": "1.0.0",
  "source_note_card_id": "source_note_card_productboard_spark_official_pm_visibility_2026",
  "workspace_id": "ws_productos_v2",
  "source_type": "competitor_site",
  "source_ref": "https://www.productboard.com/pricing/spark",
  "title": "Productboard Spark official positioning",
  "claim": "Productboard presents Spark as a specialized product agent that helps PMs move from idea to delivery-ready outputs using customer context and conversational exploration.",
  "source_snippet": "Spark is positioned as an AI product agent for idea exploration, customer understanding, and document generation.",
  "implication": "ProductOS must beat document generation alone by making artifact lineage and gate state explicit across the lifecycle.",
  "confidence": "high",
  "followup_questions": [
    "How often do Spark outputs preserve stage-by-stage approval lineage outside Productboard?"
  ],
  "source_metadata": {
    "source_url": "https://www.productboard.com/pricing/spark",
    "retrieved_at": "2026-03-23T09:15:00Z",
    "credibility_tier": "primary"
  },
  "dedupe_key": "productboard_spark_pm_visibility_2026",
  "linked_entity_refs": [
    {
      "entity_type": "opportunity",
      "entity_id": "opp_pm_lifecycle_traceability"
    }
  ],
  "tags": [
    "research",
    "competitor",
    "productboard",
    "ai"
  ],
  "created_at": "2026-03-23T09:15:00Z"
}
