{
  "schema_version": "1.0.0",
  "source_note_card_id": "source_note_card_jpd_official_pm_visibility_2026",
  "workspace_id": "ws_productos_v2",
  "source_type": "competitor_site",
  "source_ref": "https://www.atlassian.com/software/jira/product-discovery",
  "title": "Jira Product Discovery official positioning",
  "claim": "Atlassian positions Jira Product Discovery as a hub to capture insights, prioritize ideas, build roadmaps, and connect discovery directly to delivery work in Jira.",
  "source_snippet": "The product page emphasizes capturing ideas, prioritizing with customer insights, and connecting discovery with Jira delivery.",
  "implication": "ProductOS has to preserve the benefit of connected discovery and delivery while adding stronger artifact-level auditability than a linked-tool model alone.",
  "confidence": "high",
  "followup_questions": [
    "How much lifecycle visibility is still split between idea views and downstream Jira work items?"
  ],
  "source_metadata": {
    "source_url": "https://www.atlassian.com/software/jira/product-discovery",
    "retrieved_at": "2026-03-23T09:18:00Z",
    "credibility_tier": "primary"
  },
  "dedupe_key": "jpd_pm_visibility_2026",
  "linked_entity_refs": [
    {
      "entity_type": "opportunity",
      "entity_id": "opp_pm_lifecycle_traceability"
    }
  ],
  "tags": [
    "research",
    "competitor",
    "jira-product-discovery",
    "roadmapping"
  ],
  "created_at": "2026-03-23T09:18:00Z"
}
