{
  "schema_version": "1.0.0",
  "source_note_card_id": "source_note_card_linear_official_pm_visibility_2026",
  "workspace_id": "ws_productos_v2",
  "source_type": "competitor_site",
  "source_ref": "https://linear.app/features",
  "title": "Linear official product development positioning",
  "claim": "Linear frames itself as a system for modern product development that streamlines work from roadmap to release across planning, issue tracking, cycle planning, AI workflows, and customer requests.",
  "source_snippet": "The features page ties roadmap, build workflows, AI, insights, and customer requests into one product development system.",
  "implication": "ProductOS needs a similarly coherent item narrative, but with stronger PM-facing evidence lineage and explicit gates.",
  "confidence": "high",
  "followup_questions": [
    "Which parts of Linear’s workflow remain execution-first rather than discovery-trace-first for PMs?"
  ],
  "source_metadata": {
    "source_url": "https://linear.app/features",
    "retrieved_at": "2026-03-23T09:20:00Z",
    "credibility_tier": "primary"
  },
  "dedupe_key": "linear_pm_visibility_2026",
  "linked_entity_refs": [
    {
      "entity_type": "opportunity",
      "entity_id": "opp_pm_lifecycle_traceability"
    }
  ],
  "tags": [
    "research",
    "competitor",
    "linear",
    "product-development"
  ],
  "created_at": "2026-03-23T09:20:00Z"
}
